{
  "type": "never_go_alone",
  "title": "Never Go Alone",
  "description": [
    "The corridor beyond the ghost-terminal splits into three mirrored halls.",
    "Each hall resonates with a Dreamweaver cadence, inviting you to choose an Echo companion."
  ],
  "companions": [
    {
      "id": "light",
      "name": "Lumen Archivist",
      "affinityRequirement": 2,
      "abilities": [
        {
          "name": "RevealSafeTiles",
          "effect": "Highlights stable ASCII ground and prevents pitfall glyphs from spawning this tier."
        },
        {
          "name": "SanctifyGlyph",
          "effect": "Converts a corrupted glyph into a healing node once per tier."
        }
      ]
    },
    {
      "id": "mischief",
      "name": "Whisper Courier",
      "affinityRequirement": 2,
      "abilities": [
        {
          "name": "PhaseSkip",
          "effect": "Bypass one locked chamber or sealed door per tier."
        },
        {
          "name": "EchoDecoy",
          "effect": "Drops a decoy sprite that absorbs Omega Echo pursuit for one turn."
        }
      ]
    },
    {
      "id": "wrath",
      "name": "Graviton Warden",
      "affinityRequirement": 2,
      "abilities": [
        {
          "name": "GlyphBreaker",
          "effect": "Shatters a door glyph to force an alternate route."
        },
        {
          "name": "AnchorStride",
          "effect": "Stabilises a collapsing bridge for a single traversal."
        }
      ]
    }
  ],
  "escapeSequence": {
    "tiers": [
      {
        "id": "glyph_gate",
        "layout": [
          "###########",
          "#..@..D..C#",
          "#.###.###.#",
          "#.......M.#",
          "###########"
        ],
        "objective": "Use a companion ability to open the primary corridor and maintain distance from Omega Echo.",
        "echoModifier": "If Mischief is absent, Omega Echo seals door glyphs one turn earlier."
      },
      {
        "id": "anomaly_atrium",
        "layout": [
          "~~~~~~~~~~~",
          "#..@..~..C#",
          "#.###~###.#",
          "#..D..~..M#",
          "###########"
        ],
        "objective": "Chain two abilities to cross collapsing platforms and redirect the Echo.",
        "echoModifier": "If Light is absent, safe tiles flicker and require rerouting."
      },
      {
        "id": "memory_vault",
        "layout": [
          "###########",
          "#.@....#..#",
          "###.###.###",
          "#..D....C.#",
          "###########"
        ],
        "objective": "Trigger GlyphBreaker to open the final path and outrun the Omega Echo emerging from the opposite side.",
        "echoModifier": "If Wrath is absent, the Echo gains the first move on this tier."
      }
    ],
    "finale": {
      "successCondition": "TotalDreamweaverAffinity >= 6",
      "successNarration": "All companions align their sigils, sealing the exit before Omega Echo can overwrite the passphrase.",
      "fallbackNarration": "One companion becomes a lingering Echo, altering future abilities."
    }
  }
}
